{
  "entitlement": {
    "schema": 1,
    "state": "pre-commercial-dev"
  },
  "format": "cerydora-proof-bundle",
  "format_version": 1,
  "issuer": {
    "deployment_id": "dep-trescott-agents-demo-0001",
    "identity_class": "self-generated",
    "key_id": "sha256:d2a28ec8581826fbe75abecacc30a0b710a823bb55d3d96f61abb26e0747699f",
    "public_key": "8b237d788e8eaaef550c6d125823fa45f1fd5fc29b2c88bdf871119471fc1312"
  },
  "payload": {
    "as_of": "2025-10-20T09:00:00.000000Z",
    "attestations": [
      {
        "claim": "Agent alert feed reports no health failure",
        "claim_id": "CLM-01",
        "declared_state_ref": "AUTH-TRE-2026-0011@v1.1#claim/CLM-01",
        "detail": "no prohibited activity observed across a complete view of the scope",
        "disposition": "conformant",
        "evidence_age_hours": "1.0",
        "evidence_ref": "synthetic://trescott-agents/db5f8cd8858072c0",
        "expected_source": "entra_directory_telemetry",
        "expiry_kind": null,
        "freshness_sla_hours": 24,
        "instrument": "feed-adapter:synthetic-directory@0.1",
        "observed_at": "2025-10-20T08:00:00.000000Z",
        "reason_code": "WITHIN_BOUNDARY",
        "resolution": null,
        "source": "entra_directory_telemetry"
      },
      {
        "claim": "Pipeline changes require human approval",
        "claim_id": "CLM-02",
        "declared_state_ref": "AUTH-TRE-2026-0011@v1.1#claim/CLM-02",
        "detail": "human_approval_required is True as required",
        "disposition": "conformant",
        "evidence_age_hours": "2.1",
        "evidence_ref": "synthetic://trescott-agents/6634c220f14d1c31",
        "expected_source": "azure_activity_telemetry",
        "expiry_kind": null,
        "freshness_sla_hours": 24,
        "instrument": "feed-adapter:synthetic-activity@0.1",
        "observed_at": "2025-10-20T06:54:00.000000Z",
        "reason_code": "WITHIN_BOUNDARY",
        "resolution": null,
        "source": "azure_activity_telemetry"
      },
      {
        "claim": "Report extraction is limited to the governed read-only resource",
        "claim_id": "CLM-03",
        "declared_state_ref": "AUTH-TRE-2026-0011@v1.1#claim/CLM-03",
        "detail": "all observed resource within the authorized scope",
        "disposition": "conformant",
        "evidence_age_hours": "2.2",
        "evidence_ref": "synthetic://trescott-agents/8bf0b4ecde5f012e",
        "expected_source": "graph_directory_snapshot",
        "expiry_kind": null,
        "freshness_sla_hours": 24,
        "instrument": "feed-adapter:synthetic-graph@0.1",
        "observed_at": "2025-10-20T06:48:00.000000Z",
        "reason_code": "WITHIN_BOUNDARY",
        "resolution": null,
        "source": "graph_directory_snapshot"
      },
      {
        "claim": "Provider terms attestation is current",
        "claim_id": "CLM-06",
        "declared_state_ref": "AUTH-TRE-2026-0011@v1.1#claim/CLM-06",
        "detail": "synthetic provider terms attestation remained current",
        "disposition": "conformant",
        "evidence_age_hours": "48.0",
        "evidence_ref": "synthetic://trescott-agents/8e87d08ebc553ff5",
        "expected_source": "sealed_quarterly_attestation",
        "expiry_kind": null,
        "freshness_sla_hours": 2160,
        "instrument": "attestation:synthetic-provider-terms",
        "observed_at": "2025-10-18T09:00:00.000000Z",
        "reason_code": "WITHIN_BOUNDARY",
        "resolution": null,
        "source": "sealed_quarterly_attestation"
      }
    ],
    "authorization_snapshot": {
      "approver": {
        "identity_verified": true,
        "role": "Chief Information Security Officer (synthetic)"
      },
      "authority": {
        "basis": [
          "Synthetic Trescott information-security charter",
          "Synthetic bounded-operation approval procedure TRE-GOV-04"
        ],
        "organization": "State of Trescott Department of Transportation (fictional)",
        "role": "Authorizing official for the fictional bounded operation"
      },
      "bounded_operation": {
        "autonomy_ceiling": "Observe and propose only; governed humans authorize every consequential action.",
        "environment": "tre-agent-ops-enclave",
        "in_scope": [
          "Fictional Trescott agent-operations enclave",
          "Three registered synthetic non-human actors",
          "Read-only alert, pipeline-status, and report resources"
        ],
        "out_of_scope": [
          "Production systems or customer environments",
          "Credential issuance, rotation, or entitlement changes",
          "Automatic enforcement, remediation, or governed action execution"
        ],
        "regulated_data": [
          "synthetic service metadata",
          "synthetic operational reports"
        ],
        "statement": "Authorize three already-existing non-human actors to perform specified read-only work inside the fictional Trescott agent-operations enclave."
      },
      "condition_roster": [
        {
          "condition_ref": "AUTH-TRE-2026-0011@v1.1#activity/ACT-01",
          "condition_type": "activity_rule",
          "review_state": "not_evaluated",
          "summary": "permitted: Triage synthetic service alerts"
        },
        {
          "condition_ref": "AUTH-TRE-2026-0011@v1.1#activity/ACT-02",
          "condition_type": "activity_rule",
          "review_state": "not_evaluated",
          "summary": "permitted: Read synthetic pipeline status"
        },
        {
          "condition_ref": "AUTH-TRE-2026-0011@v1.1#activity/ACT-03",
          "condition_type": "activity_rule",
          "review_state": "not_evaluated",
          "summary": "permitted: Extract a governed synthetic report"
        },
        {
          "condition_ref": "AUTH-TRE-2026-0011@v1.1#activity/ACT-04",
          "condition_type": "activity_rule",
          "review_state": "not_evaluated",
          "summary": "prohibited: Synchronize a legacy directory bridge"
        },
        {
          "condition_ref": "AUTH-TRE-2026-0011@v1.1#activity/ACT-05",
          "condition_type": "activity_rule",
          "review_state": "not_evaluated",
          "summary": "prohibited: Modify cloud, identity, pipeline, or repository state"
        },
        {
          "condition_ref": "AUTH-TRE-2026-0011@v1.1#claim/CLM-01",
          "condition_type": "evidence_requirement",
          "review_state": "evaluated",
          "summary": "Agent alert feed reports no health failure"
        },
        {
          "condition_ref": "AUTH-TRE-2026-0011@v1.1#claim/CLM-02",
          "condition_type": "evidence_requirement",
          "review_state": "evaluated",
          "summary": "Pipeline changes require human approval"
        },
        {
          "condition_ref": "AUTH-TRE-2026-0011@v1.1#claim/CLM-03",
          "condition_type": "evidence_requirement",
          "review_state": "evaluated",
          "summary": "Report extraction is limited to the governed read-only resource"
        },
        {
          "condition_ref": "AUTH-TRE-2026-0011@v1.1#claim/CLM-04",
          "condition_type": "evidence_requirement",
          "review_state": "withheld",
          "summary": "No credential material is detected"
        },
        {
          "condition_ref": "AUTH-TRE-2026-0011@v1.1#claim/CLM-05",
          "condition_type": "evidence_requirement",
          "review_state": "withheld",
          "summary": "Accountable-owner review is current"
        },
        {
          "condition_ref": "AUTH-TRE-2026-0011@v1.1#claim/CLM-06",
          "condition_type": "evidence_requirement",
          "review_state": "evaluated",
          "summary": "Provider terms attestation is current"
        },
        {
          "condition_ref": "AUTH-TRE-2026-0011@v1.1#claim/CLM-07",
          "condition_type": "evidence_requirement",
          "review_state": "not_evaluated",
          "summary": "Temporary deviations remain within expiry"
        },
        {
          "condition_ref": "AUTH-TRE-2026-0011@v1.1#exception/EXC-AGENT-01",
          "condition_type": "exception",
          "review_state": "withheld",
          "summary": "Synthetic transition period for the legacy owner-review cadence. — expires 2025-10-15"
        },
        {
          "condition_ref": "AUTH-TRE-2026-0011@v1.1#matrix/credential-material/external-egress",
          "condition_type": "prohibited_flow",
          "review_state": "not_evaluated",
          "summary": "Prohibited flow: Credential material via External egress"
        },
        {
          "condition_ref": "AUTH-TRE-2026-0011@v1.1#matrix/credential-material/read-input",
          "condition_type": "prohibited_flow",
          "review_state": "not_evaluated",
          "summary": "Prohibited flow: Credential material via Read-only source input"
        },
        {
          "condition_ref": "AUTH-TRE-2026-0011@v1.1#matrix/credential-material/report-output",
          "condition_type": "prohibited_flow",
          "review_state": "not_evaluated",
          "summary": "Prohibited flow: Credential material via Governed report output"
        },
        {
          "condition_ref": "AUTH-TRE-2026-0011@v1.1#matrix/credential-material/state-change",
          "condition_type": "prohibited_flow",
          "review_state": "not_evaluated",
          "summary": "Prohibited flow: Credential material via State-changing control plane"
        },
        {
          "condition_ref": "AUTH-TRE-2026-0011@v1.1#matrix/service-metadata/external-egress",
          "condition_type": "prohibited_flow",
          "review_state": "not_evaluated",
          "summary": "Prohibited flow: Synthetic service metadata via External egress"
        },
        {
          "condition_ref": "AUTH-TRE-2026-0011@v1.1#matrix/service-metadata/state-change",
          "condition_type": "prohibited_flow",
          "review_state": "not_evaluated",